{
 "$schema": "http://json-schema.org/draft-07/schema#",
 "$id": "ir_v0.schema.json",
 "title": "Notation IR document v0",
 "type": "object",
 "required": [
  "irVersion",
  "id",
  "source",
  "provenance",
  "events",
  "chunks",
  "overlays"
 ],
 "additionalProperties": false,
 "properties": {
  "irVersion": {
   "const": "0.1"
  },
  "id": {
   "type": "string",
   "pattern": "^[a-z0-9][a-z0-9-]*$"
  },
  "source": {
   "type": "object",
   "required": [
    "score",
    "window",
    "parts"
   ],
   "additionalProperties": false,
   "properties": {
    "score": {
     "type": "string"
    },
    "window": {
     "$ref": "#/definitions/span"
    },
    "parts": {
     "type": "array",
     "items": {
      "type": "integer",
      "minimum": 0,
      "maximum": 9
     },
     "minItems": 1
    }
   }
  },
  "provenance": {
   "$ref": "#/definitions/docProvenance"
  },
  "events": {
   "type": "array",
   "items": {
    "$ref": "#/definitions/event"
   }
  },
  "chunks": {
   "type": "array",
   "items": {
    "$ref": "#/definitions/chunk"
   }
  },
  "overlays": {
   "type": "array",
   "items": {
    "$ref": "#/definitions/overlay"
   }
  },
  "layoutPolicy": {
   "type": "object",
   "properties": {
    "bracketSide": {
     "enum": [
      "above"
     ]
    }
   },
   "additionalProperties": false
  },
  "hideMarkers": {
   "type": "boolean",
   "_note": "day 35: this page does not draw the score's markers. The trance section's beat numbers and structural labels are rehearsal scaffolding, not notation."
  },
  "animated": {
   "type": "object",
   "additionalProperties": {
    "type": "boolean"
   },
   "_note": "day 35 in the code, day 36 in this schema: a page may switch OFF animated object kinds it does not want (animobj.collect's kindOn filter) - the morph pages want their two meters and none of the dots, the trance page wants its ball and no progress rings over the long tones. FIFTH TIME THE GATE HAS BITTEN (see _kindNote..3 and devices[].preset): all three morph pages have carried `animated` since day 35 and NONE of them ever passed validation, because notate_morph.js writes without validating (NITS). The property was legal in the renderer and illegal in the file, and the first VALIDATED page to carry one was REJECTED and DELETED on write."
  }
 },
 "definitions": {
  "span": {
   "type": "array",
   "items": {
    "type": "number",
    "minimum": 0
   },
   "minItems": 2,
   "maxItems": 2
  },
  "nodeProv": {
   "enum": [
    "derived",
    "authored"
   ]
  },
  "overlayProv": {
   "enum": [
    "authored",
    "authored-override"
   ]
  },
  "docProvenance": {
   "type": "object",
   "required": [
    "createdBy",
    "date"
   ],
   "additionalProperties": false,
   "properties": {
    "createdBy": {
     "type": "string"
    },
    "date": {
     "type": "string"
    },
    "tool": {
     "type": [
      "string",
      "null"
     ]
    },
    "notes": {
     "type": "string"
    },
    "build": {
     "type": "string",
     "description": "amendment 6 (2026-08-23): the exact command line that produced this document. A version file is derived — the archive plus the composer's decisions — and those decisions ARE the argv; storing it lets the file say how to rebuild itself without the journal."
    }
   }
  },
  "event": {
   "type": "object",
   "required": [
    "id",
    "onset",
    "duration",
    "pitch",
    "technique",
    "provenance"
   ],
   "additionalProperties": false,
   "properties": {
    "id": {
     "type": "string",
     "pattern": "^ev-[A-Za-z0-9_-]+$"
    },
    "source": {
     "type": "object",
     "required": [
      "score",
      "objectId"
     ],
     "additionalProperties": false,
     "properties": {
      "score": {
       "type": "string"
      },
      "objectId": {
       "type": "string"
      }
     }
    },
    "onset": {
     "type": "number",
     "minimum": 0
    },
    "duration": {
     "type": "number",
     "exclusiveMinimum": 0
    },
    "pitch": {
     "type": "object",
     "required": [
      "midi",
      "spelled"
     ],
     "additionalProperties": false,
     "properties": {
      "midi": {
       "type": "number",
       "minimum": 0,
       "maximum": 127
      },
      "spelled": {
       "type": "object",
       "required": [
        "step",
        "alter",
        "octave"
       ],
       "additionalProperties": false,
       "properties": {
        "step": {
         "enum": [
          "A",
          "B",
          "C",
          "D",
          "E",
          "F",
          "G"
         ]
        },
        "alter": {
         "type": "number",
         "multipleOf": 0.5,
         "minimum": -2,
         "maximum": 2
        },
        "octave": {
         "type": "integer",
         "minimum": -1,
         "maximum": 9
        }
       }
      }
     }
    },
    "technique": {
     "type": "string"
    },
    "metric": {
     "type": "object",
     "required": [
      "chunk",
      "grid"
     ],
     "additionalProperties": false,
     "properties": {
      "chunk": {
       "type": "string"
      },
      "grid": {
       "type": "array",
       "items": {
        "type": "integer",
        "minimum": 0
       },
       "minItems": 1
      }
     }
    },
    "provenance": {
     "$ref": "#/definitions/nodeProv"
    },
    "env": {
     "type": "string",
     "description": "envelope species as drawn (surge, sine, expodec, ...) — day 22 amendment 3, optional; 'strike' = a note the strikes tool wrote (§400); 'trill' = a composer-score trill zone (PLAN 2f.3, 2026-09-13); a crescendo-tool swell carries its family name (properties.cresc.shape: 'surge' = the standard — PLAN 2i.8, 2026-09-15); 'sequence' = a breath of a sequence named by notate_section --sequence (srcKind 'sequence', LGMF PLAN 2d.1, 2026-09-25) — its line is the part's 'sequence' overlay; 'vibBow' = a BOW of the bowed vibraphone in such a sequence (LGMF PLAN 2g.3, 2026-09-27) — the byEnv.vibBow device, its marks in the part's 'vibBows' overlay; 'longTone' = a held note of a group, named by notate_section --longTones (LGMF PLAN 2m.2, 2026-09-29) — the byEnv.longTone device; 'plainNote' = a note named by notate_section --plainNotes P:T0:T1 (RUNNING_LOG §547, 2026-09-29) — the byEnv.plainNote device, a filled head with a plain stem on its time"
    },
    "secco": {
     "type": "boolean",
     "description": "the swell ends secco — the strings damp at the cut, the winds take the word for the shape (the crescendo tool's properties.cresc.secco, CN-49); the page writes 'sempre secco' once per part at its first such event (D54) — PLAN 2i.8 amendment 9, 2026-09-15, optional"
    },
    "mode": {
     "enum": [
      "plain",
      "ks"
     ],
     "description": "non-default sonify mode (plain = captured note, ks = keyswitched sample); curve mode = field omitted — day 22 amendment 3, optional"
    },
    "vel": {
     "type": "integer",
     "minimum": 1,
     "maximum": 127,
     "description": "the captured MIDI velocity of a plain-mode note (the score object's recVel — a play-in or engine value, see DYNAMICS_FRAMEWORK.md §2); the one-shot dynamic mark derives from it through registry dynamicBands — day 23 amendment 5, optional, plain-mode events only"
    },
    "level": {
     "type": "object",
     "description": "the drawn level curve, normalized samples 0-1 over the note span (piece #1 curve-library precedent; sampled at extract time by sonify_core.evalWaveCurve) — day 22 amendment 4, optional, curve-mode events only; for env trill: the composer score's own trill reference (auto/A/B/C/lane/flat) sampled over the trill span with composer.html getYAtPos (PLAN 2f.3)",
     "properties": {
      "samples": {
       "type": "array",
       "items": {
        "type": "number",
        "minimum": 0,
        "maximum": 1
       },
       "minItems": 2
      }
     },
     "required": [
      "samples"
     ],
     "additionalProperties": false
    },
    "trill": {
     "type": "object",
     "description": "PLAN 2f.3 (2026-09-13) — an env trill event's neighbour and curve reference (docs/TRILL_NOTATION_SPEC.md §1). The sounding neighbour = pitch.midi + interval; spelled = the next letter name up (a second). curve names the reference the level was sampled from (auto:A, C, lane, flat ...).",
     "required": [
      "interval",
      "neighbour"
     ],
     "additionalProperties": false,
     "properties": {
      "interval": {
       "type": "integer",
       "minimum": -12,
       "maximum": 12
      },
      "neighbour": {
       "type": "object",
       "required": [
        "midi",
        "spelled"
       ],
       "additionalProperties": false,
       "properties": {
        "midi": {
         "type": "integer",
         "minimum": 0,
         "maximum": 127
        },
        "spelled": {
         "type": "object",
         "required": [
          "step",
          "alter",
          "octave"
         ],
         "additionalProperties": false,
         "properties": {
          "step": {
           "enum": [
            "A",
            "B",
            "C",
            "D",
            "E",
            "F",
            "G"
           ]
          },
          "alter": {
           "type": "number",
           "multipleOf": 0.5,
           "minimum": -2,
           "maximum": 2
          },
          "octave": {
           "type": "integer",
           "minimum": -1,
           "maximum": 9
          }
         }
        }
       }
      },
      "curve": {
       "type": "string"
      }
     }
    }
   }
  },
  "chunk": {
   "type": "object",
   "required": [
    "id",
    "part",
    "span",
    "class",
    "strategy",
    "events",
    "provenance"
   ],
   "additionalProperties": false,
   "properties": {
    "id": {
     "type": "string",
     "pattern": "^ch-[A-Za-z0-9_-]+$"
    },
    "part": {
     "type": "integer",
     "minimum": 0,
     "maximum": 9
    },
    "span": {
     "$ref": "#/definitions/span"
    },
    "class": {
     "type": "string"
    },
    "strategy": {
     "enum": [
      "simple-bar",
      "tuplet-bar",
      "proportional",
      "device",
      "fallback",
      "unresolved"
     ]
    },
    "tempo": {
     "type": "object",
     "required": [
      "anchorSeconds",
      "unitSeconds",
      "beatSeconds",
      "label"
     ],
     "additionalProperties": false,
     "properties": {
      "anchorSeconds": {
       "type": "number",
       "minimum": 0
      },
      "unitSeconds": {
       "type": "number",
       "exclusiveMinimum": 0
      },
      "beatSeconds": {
       "type": "number",
       "exclusiveMinimum": 0
      },
      "subdivision": {
       "type": "integer",
       "minimum": 1
      },
      "maxErrSeconds": {
       "type": "number",
       "minimum": 0
      },
      "label": {
       "type": "string"
      }
     }
    },
    "events": {
     "type": "array",
     "items": {
      "type": "string"
     }
    },
    "groups": {
     "type": "array",
     "items": {
      "type": "object",
      "required": [
       "id",
       "kind",
       "events",
       "provenance"
      ],
      "additionalProperties": false,
      "properties": {
       "id": {
        "type": "string",
        "pattern": "^bg-[A-Za-z0-9_-]+$"
       },
       "kind": {
        "enum": [
         "beam"
        ]
       },
       "events": {
        "type": "array",
        "items": {
         "type": "string"
        },
        "minItems": 2
       },
       "provenance": {
        "$ref": "#/definitions/nodeProv"
       }
      }
     }
    },
    "devices": {
     "type": "array",
     "items": {
      "type": "object",
      "required": [
       "id",
       "kind",
       "mode",
       "at",
       "provenance"
      ],
      "additionalProperties": false,
      "properties": {
       "id": {
        "type": "string",
        "pattern": "^dev-[A-Za-z0-9_-]+$"
       },
       "kind": {
        "type": "string"
       },
       "mode": {
        "type": "string"
       },
       "at": {
        "type": "number",
        "minimum": 0
       },
       "preset": {
        "type": "object",
        "_note": "day 36, THE PER-PART BALL: a chunk gc device may carry a GC preset — the trance revision tiles one ball per lane at each part's own tempo (preset.duration = that part's step, so the balls abut with no gap and no overlap). Without this property the node's additionalProperties:false REJECTED the page and ir_validate DELETED it on write — the fourth time the gate has bitten (see _kindNote..3)."
       },
       "provenance": {
        "$ref": "#/definitions/nodeProv"
       }
      }
     }
    },
    "provenance": {
     "$ref": "#/definitions/nodeProv"
    }
   }
  },
  "overlay": {
   "type": "object",
   "required": [
    "id",
    "kind",
    "target",
    "value",
    "provenance"
   ],
   "additionalProperties": false,
   "properties": {
    "id": {
     "type": "string",
     "pattern": "^ov-[A-Za-z0-9_-]+$"
    },
    "kind": {
     "enum": [
      "dynamic",
      "articulation",
      "instruction",
      "spelling",
      "grouping",
      "strategy",
      "engraving",
      "header",
      "gliss",
      "cresc",
      "tempo",
      "sequence",
      "vibBows",
      "rest",
      "beatGrid",
      "micOpening",
      "badge",
      "elecReturn",
      "elecWindow",
      "stateWedge"
     ]
    },
    "_kindNote": "day 23 amendment 6: 'engraving' — the V1 per-item override channel (value.device = a device-membership override; also stemDir, spelled, nudges). layout.js has consumed it since day 22, but the enum never listed it, so a VALIDATED IR could not carry one — the channel existed only in hand-built test objects. Found the moment the first real one was written (the composer's beamed cluster, notate_section --cluster).",
    "target": {
     "type": "object",
     "minProperties": 1,
     "additionalProperties": false,
     "properties": {
      "event": {
       "type": "string"
      },
      "chunk": {
       "type": "string"
      },
      "part": {
       "type": "integer",
       "minimum": 0,
       "maximum": 9
      },
      "parts": {
       "type": "array",
       "items": {
        "type": "integer",
        "minimum": 0,
        "maximum": 9
       },
       "minItems": 1
      },
      "span": {
       "$ref": "#/definitions/span"
      },
      "t": {
       "type": "number",
       "minimum": 0
      }
     }
    },
    "value": {},
    "provenance": {
     "$ref": "#/definitions/overlayProv"
    },
    "contradicts": {
     "type": [
      "object",
      "string",
      "null"
     ]
    },
    "orphaned": {
     "type": "boolean"
    }
   },
   "_kindNote2": "day 35: 'gliss', 'cresc' and 'header' - the morph-section channels. A gliss/cresc overlay carries {part, span} and a normalised 0..1 sample array: the drawn displacement curve for that part's half of the lane. A header overlay carries {part, t} and the section's written pitches plus its dynamic figure. Added the moment the first real one was folded into a VALIDATED page - exactly the failure the note above records for 'engraving', and it bit the same way: notate_morph.js writes its own files unvalidated, so three morph pages existed and passed nothing, while the first attempt to fold them into MAIN DRAFT was REJECTED and the page DELETED. The standalone writer should validate too; see NITS.",
   "_kindNote3": "day 35: 'tempo' - the trance section's bar lines. A tempo overlay carries {t} and {bpm}: a bar line on every part at that moment, a medium space left of the bar's leftmost ink, with the tempo stated once at the top. Third time the enum has had to be widened for a channel layout.js already understood (see _kindNote and _kindNote2). The pattern is now clear enough to name: THIS SCHEMA IS A GATE ON THE FILE, NOT A DESCRIPTION OF THE RENDERER, so any new overlay kind must be added here in the same commit or the page is rejected and DELETED on write.",
   "_kindNote4": "LGMF PLAN 2d.1 (2026-09-25, RUNNING_LOG §382): 'sequence' - one part's line of a SEQUENCE (the sequence drawer's notes, one grp-seq-* group). target {part, span}; value {group, name, scale {kind 'fixed', steps 8, names, ladder (the part's CC7 for ppp … fff), instKey}, entry {event, t, release, technique, techText, range, rangeText, midi, cents, centsText, partial, fundamental, fundamentalMidi, partialText, box, take}, level {sps, t0, t1, samples: the WRITTEN LEVEL 0 … 1 on the fixed scale - niente 0, ppp 1/8 … fff 8/8}, breaths [{event, onset, release, pitch 'same' | 'new', midi, and for 'new' the entry's marks}], labels [{t, mark, kind 'crest' | 'trough', level}]}. Built by notation/lib/sequence_overlays.js from the save (D9); the breaths' events carry env 'sequence'. Added in the same commit as the first page that holds one - the rule of _kindNote3.",
   "_kindNote5": "LGMF PLAN 2g.3 (2026-09-27, RUNNING_LOG §469; the device sheet §466): 'vibBows' - the bowed vibraphone's two voices of strokes in one SEQUENCE (lane 5's notes of one grp-seq-* group; its events carry env 'vibBow'). target {part, span}; value {group, name, ladder (the part's CC7 for ppp … fff), bows [{event, chain (0 | 1: the seat, the lane's overlap chains), voice ('upper' | 'lower': by register), t0, t1, midi, restart, startName, marks [{kind 'name' | 'niente' | 'hairpin', t, tEnd, dir 'cresc' | 'decresc', name, start, from, to}]}]}. Built by notation/lib/vib_marks.js from the save (D9) under rules.json vibMarks. Added in the same commit as the first page that holds one - the rule of _kindNote3.",
   "_kindNote7": "decibel PLAN 2.7 (2026-10-09, RUNNING_LOG §335; DEC-111): THE PRESENTATION VIEW'S LAYER — the hint of the electronics, never on a player's page. 'elecReturn' - a return brick of the composer score (midiModel elecPlay): target {part, span} (the REGION the engine rolls the sounds' times inside); value {source: the zone's id, behaviour, count: the number of sounds the brick carries, all: true for the whole bank}; written by the extractor with options.elec (notate_section --elec). A 'badge' may carry value.row 'elec': the electronics' badge, a row of rules.json electronics.badges, drawn in the lane's electronics' row (notate_section --elecBadge). layout.js turns the return into the item 'elecret' {t0, t1, count, all}; the renderer places both in the lane's electronics' row (rules.json objects.elecReturn · objects.elecBadge). 'elecWindow' (DEC-112, §336; DEC-114, §338): the see-through grey window round a return brick and the badge before it — target {part, span: the brick's}; value {badgeLeft: true when a badge stands before the brick, so the window reaches left to it}; written by notate_section --elecWindow t0:t1 (one a brick; with :lane one a lane over its whole stretch, the first brick's start to the last's end, on the lane's first part); the item 'elecwin' {t0, t1, badgeLeft}, drawn under the row's badges and bricks (rules.json objects.elecWindow). A badge with row 'elec' may stand before EVERY brick of a stretch (--elecBadge type:t0:t1:each).",
   "_kindNote6": "decibel PLAN 2.4 · 2.6 (2026-10-09, RUNNING_LOG §325; the device sheet in it): THE LANE'S OWN MARKS, which belong to a lane and to no note. 'micOpening' - when the player plays into the microphone, and for how long: target {part, span}; value {source: the composer score's zone id (midiModel elecOpen), sample: the name it banks, or null}; written by the extractor with options.mics. 'badge' - a language badge, what KIND of sound: target {part, t}; value {type: a row of rules.json language.types, place: 'before' (its right edge a gap before t - a badge before its mic opening) | 'at' (its left edge on t)}; written by notate_section --announce · --micBadge. layout.js turns them into the items 'mic' and 'badge'; the renderer places both in the lane's mic row (rules.json objects.micOpening · objects.badge)."
  }
 }
}