{
 "irVersion": "0.1",
 "id": "approaching-opening-elec",
 "source": {
  "score": "piece-3BodyRedo",
  "window": [
   0,
   37
  ],
  "parts": [
   0,
   1,
   2,
   3,
   4,
   5
  ]
 },
 "provenance": {
  "createdBy": "tools/notate_section.js (profile trance) --mics --elec",
  "date": "2026-10-09",
  "tool": "tools/notate_section.js (profile trance) --mics --elec",
  "notes": "Derived extraction (B1). Segmentation: DB-6 greedy IOI runs, TOL 0.015 s. Regenerable; authored content belongs in overlays only. MIC OPENINGS (decibel PLAN 2.4): 30 zone(s) elecOpen as micOpening overlays. THE ELECTRONICS (decibel PLAN 2.7): 25 zone(s) elecPlay as elecReturn overlays.",
  "build": "node tools/notate_section.js --score piece-3BodyRedo --w0 0 --w1 37 --id approaching-opening-elec --label \"Approaching — the opening, with the electronics (0 … 37 s)\" --mics --silent 0-37 --announce shortAttacks:0:37 --elec --elecBadge flocking:0:37:each --elecWindow 0:37"
 },
 "events": [
  {
   "id": "ev-wc-19",
   "source": {
    "score": "piece-3BodyRedo",
    "objectId": "wc-19"
   },
   "onset": 1.525,
   "duration": 0.1499999999999999,
   "pitch": {
    "midi": 59,
    "spelled": {
     "step": "B",
     "alter": 0,
     "octave": 3
    }
   },
   "technique": "slap",
   "provenance": "derived",
   "mode": "plain",
   "vel": 127
  },
  {
   "id": "ev-wc-20",
   "source": {
    "score": "piece-3BodyRedo",
    "objectId": "wc-20"
   },
   "onset": 2.669,
   "duration": 0.1499999999999999,
   "pitch": {
    "midi": 50,
    "spelled": {
     "step": "D",
     "alter": 0,
     "octave": 3
    }
   },
   "technique": "slap",
   "provenance": "derived",
   "mode": "plain",
   "vel": 127
  },
  {
   "id": "ev-wc-21",
   "source": {
    "score": "piece-3BodyRedo",
    "objectId": "wc-21"
   },
   "onset": 4.145,
   "duration": 0.15000000000000036,
   "pitch": {
    "midi": 43,
    "spelled": {
     "step": "G",
     "alter": 0,
     "octave": 2
    }
   },
   "technique": "shime_daiko_taiko_sticks",
   "provenance": "derived",
   "mode": "plain",
   "vel": 127
  },
  {
   "id": "ev-wc-22",
   "source": {
    "score": "piece-3BodyRedo",
    "objectId": "wc-22"
   },
   "onset": 4.48,
   "duration": 0.818,
   "pitch": {
    "midi": 71,
    "spelled": {
     "step": "B",
     "alter": 0,
     "octave": 4
    }
   },
   "technique": "bartok_vel",
   "provenance": "derived",
   "mode": "plain",
   "vel": 127
  },
  {
   "id": "ev-wc-23",
   "source": {
    "score": "piece-3BodyRedo",
    "objectId": "wc-23"
   },
   "onset": 5.212,
   "duration": 1.033,
   "pitch": {
    "midi": 56,
    "spelled": {
     "step": "G",
     "alter": 1,
     "octave": 3
    }
   },
   "technique": "gettato_vel",
   "provenance": "derived",
   "mode": "plain",
   "vel": 127
  },
  {
   "id": "ev-wc-52",
   "source": {
    "score": "piece-3BodyRedo",
    "objectId": "wc-52"
   },
   "onset": 6.639,
   "duration": 0.14999999999999947,
   "pitch": {
    "midi": 51,
    "spelled": {
     "step": "D",
     "alter": 1,
     "octave": 3
    }
   },
   "technique": "marcato_sfz_vel",
   "provenance": "derived",
   "mode": "plain",
   "vel": 127
  },
  {
   "id": "ev-wc-25",
   "source": {
    "score": "piece-3BodyRedo",
    "objectId": "wc-25"
   },
   "onset": 6.991,
   "duration": 0.15000000000000036,
   "pitch": {
    "midi": 70,
    "spelled": {
     "step": "A",
     "alter": 1,
     "octave": 4
    }
   },
   "technique": "glock_shorts_hard",
   "provenance": "derived",
   "mode": "plain",
   "vel": 127
  },
  {
   "id": "ev-wc-26",
   "source": {
    "score": "piece-3BodyRedo",
    "objectId": "wc-26"
   },
   "onset": 8.251,
   "duration": 1.22,
   "pitch": {
    "midi": 53,
    "spelled": {
     "step": "F",
     "alter": 0,
     "octave": 3
    }
   },
   "technique": "stac_vel",
   "provenance": "derived",
   "mode": "plain",
   "vel": 127
  },
  {
   "id": "ev-wc-27",
   "source": {
    "score": "piece-3BodyRedo",
    "objectId": "wc-27"
   },
   "onset": 9.9,
   "duration": 0.15000000000000036,
   "pitch": {
    "midi": 44,
    "spelled": {
     "step": "G",
     "alter": 1,
     "octave": 2
    }
   },
   "technique": "bow_op_x_marcato_sfz_mw_vel",
   "provenance": "derived",
   "mode": "plain",
   "vel": 127
  },
  {
   "id": "ev-wc-28",
   "source": {
    "score": "piece-3BodyRedo",
    "objectId": "wc-28"
   },
   "onset": 10.137,
   "duration": 0.15000000000000036,
   "pitch": {
    "midi": 34,
    "spelled": {
     "step": "A",
     "alter": 1,
     "octave": 1
    }
   },
   "technique": "flutter_vel_mwinv",
   "provenance": "derived",
   "mode": "plain",
   "vel": 127
  },
  {
   "id": "ev-wc-29",
   "source": {
    "score": "piece-3BodyRedo",
    "objectId": "wc-29"
   },
   "onset": 11.222,
   "duration": 0.15000000000000036,
   "pitch": {
    "midi": 60,
    "spelled": {
     "step": "C",
     "alter": 0,
     "octave": 4
    }
   },
   "technique": "china_cymbals_scrape",
   "provenance": "derived",
   "mode": "plain",
   "vel": 127
  },
  {
   "id": "ev-wc-30",
   "source": {
    "score": "piece-3BodyRedo",
    "objectId": "wc-30"
   },
   "onset": 12.182,
   "duration": 0.15000000000000036,
   "pitch": {
    "midi": 61,
    "spelled": {
     "step": "C",
     "alter": 1,
     "octave": 4
    }
   },
   "technique": "voice_breath_4th",
   "provenance": "derived",
   "mode": "plain",
   "vel": 127
  },
  {
   "id": "ev-wc-31",
   "source": {
    "score": "piece-3BodyRedo",
    "objectId": "wc-31"
   },
   "onset": 13.373,
   "duration": 0.15000000000000036,
   "pitch": {
    "midi": 62,
    "spelled": {
     "step": "D",
     "alter": 0,
     "octave": 4
    }
   },
   "technique": "sp_spicc_vel",
   "provenance": "derived",
   "mode": "plain",
   "vel": 127
  },
  {
   "id": "ev-wc-32",
   "source": {
    "score": "piece-3BodyRedo",
    "objectId": "wc-32"
   },
   "onset": 14.942,
   "duration": 0.15000000000000036,
   "pitch": {
    "midi": 44,
    "spelled": {
     "step": "G",
     "alter": 1,
     "octave": 2
    }
   },
   "technique": "col_legno_vel",
   "provenance": "derived",
   "mode": "plain",
   "vel": 127
  },
  {
   "id": "ev-wc-33",
   "source": {
    "score": "piece-3BodyRedo",
    "objectId": "wc-33"
   },
   "onset": 16.353,
   "duration": 0.14999999999999858,
   "pitch": {
    "midi": 52,
    "spelled": {
     "step": "E",
     "alter": 0,
     "octave": 3
    }
   },
   "technique": "secco",
   "provenance": "derived",
   "mode": "plain",
   "vel": 127
  },
  {
   "id": "ev-wc-34",
   "source": {
    "score": "piece-3BodyRedo",
    "objectId": "wc-34"
   },
   "onset": 17.818,
   "duration": 0.88,
   "pitch": {
    "midi": 36,
    "spelled": {
     "step": "C",
     "alter": 0,
     "octave": 2
    }
   },
   "technique": "bartok_vel",
   "provenance": "derived",
   "mode": "plain",
   "vel": 127
  },
  {
   "id": "ev-wc-35",
   "source": {
    "score": "piece-3BodyRedo",
    "objectId": "wc-35"
   },
   "onset": 18.099,
   "duration": 0.14999999999999858,
   "pitch": {
    "midi": 50,
    "spelled": {
     "step": "D",
     "alter": 0,
     "octave": 3
    }
   },
   "technique": "bow_op_vel",
   "provenance": "derived",
   "mode": "plain",
   "vel": 127
  },
  {
   "id": "ev-wc-36",
   "source": {
    "score": "piece-3BodyRedo",
    "objectId": "wc-36"
   },
   "onset": 18.862,
   "duration": 0.15000000000000213,
   "pitch": {
    "midi": 50,
    "spelled": {
     "step": "D",
     "alter": 0,
     "octave": 3
    }
   },
   "technique": "jet_slap",
   "provenance": "derived",
   "mode": "plain",
   "vel": 127
  },
  {
   "id": "ev-wc-37",
   "source": {
    "score": "piece-3BodyRedo",
    "objectId": "wc-37"
   },
   "onset": 20.794,
   "duration": 0.14999999999999858,
   "pitch": {
    "midi": 37,
    "spelled": {
     "step": "C",
     "alter": 1,
     "octave": 2
    }
   },
   "technique": "mp_short",
   "provenance": "derived",
   "mode": "plain",
   "vel": 127
  },
  {
   "id": "ev-wc-38",
   "source": {
    "score": "piece-3BodyRedo",
    "objectId": "wc-38"
   },
   "onset": 22.261,
   "duration": 0.15000000000000213,
   "pitch": {
    "midi": 81,
    "spelled": {
     "step": "A",
     "alter": 0,
     "octave": 5
    }
   },
   "technique": "crot_main_metal_damped",
   "provenance": "derived",
   "mode": "plain",
   "vel": 127
  },
  {
   "id": "ev-wc-39",
   "source": {
    "score": "piece-3BodyRedo",
    "objectId": "wc-39"
   },
   "onset": 22.991,
   "duration": 0.14999999999999858,
   "pitch": {
    "midi": 51,
    "spelled": {
     "step": "D",
     "alter": 1,
     "octave": 3
    }
   },
   "technique": "marcato_sfz_vel",
   "provenance": "derived",
   "mode": "plain",
   "vel": 127
  },
  {
   "id": "ev-wc-40",
   "source": {
    "score": "piece-3BodyRedo",
    "objectId": "wc-40"
   },
   "onset": 24.595,
   "duration": 0.15000000000000213,
   "pitch": {
    "midi": 36,
    "spelled": {
     "step": "C",
     "alter": 0,
     "octave": 2
    }
   },
   "technique": "wood_blocks_hard_mallets",
   "provenance": "derived",
   "mode": "plain",
   "vel": 127
  },
  {
   "id": "ev-wc-41",
   "source": {
    "score": "piece-3BodyRedo",
    "objectId": "wc-41"
   },
   "onset": 25.825,
   "duration": 0.15000000000000213,
   "pitch": {
    "midi": 54,
    "spelled": {
     "step": "F",
     "alter": 1,
     "octave": 3
    }
   },
   "technique": "pseudo_cb_vel_mwinv",
   "provenance": "derived",
   "mode": "plain",
   "vel": 127
  },
  {
   "id": "ev-wc-42",
   "source": {
    "score": "piece-3BodyRedo",
    "objectId": "wc-42"
   },
   "onset": 26.17,
   "duration": 0.14999999999999858,
   "pitch": {
    "midi": 61,
    "spelled": {
     "step": "C",
     "alter": 1,
     "octave": 4
    }
   },
   "technique": "nh_sul1_vel",
   "provenance": "derived",
   "mode": "plain",
   "vel": 127
  },
  {
   "id": "ev-wc-43",
   "source": {
    "score": "piece-3BodyRedo",
    "objectId": "wc-43"
   },
   "onset": 27.413,
   "duration": 0.14999999999999858,
   "pitch": {
    "midi": 34,
    "spelled": {
     "step": "A",